{
  "$schema": "../../../tools/schemas/fable2-gpu-experiment-backlog-v1.schema.json",
  "schema_version": "1.0.0",
  "corpus": "Fable II Native Renderer G1.5D",
  "generated_on": "2026-09-01",
  "pins": {
    "fable_commit": "3cef954120e062974f3fcdf707ac302aa0e2d44e",
    "rexglue_commit": "956c6a8b5da4c54b9899a2593e9c67c26de30194",
    "active_dll_sha256": "8232051BED6E5CE99CF37B2EF581C824F58875C140A4D3C75DE14E8A5DF4AA99"
  },
  "capture_root_contract": {
    "requirement": "Every future runtime record must be placed beneath a per-run directory under out/gpu-evidence-runs only after git check-ignore confirms the exact directory is ignored.",
    "forbidden_locations": [
      "repository documentation directories",
      "generated source directories",
      "game assets",
      "user save/profile directories",
      "reference repositories"
    ],
    "verification": "Before and after each later experiment: git check-ignore -v <exact-directory>, git status --short --untracked-files=all, bounded size/file count, then retain or delete only that exact verified directory."
  },
  "experiments": [
    {
      "experiment_id": "EXP-STATIC-XDK-001",
      "order": 1,
      "type": "STATIC",
      "question_answered": "Can exact TU1 static analysis recover representative draw, resource, shader and render-target methods with a stable ABI, or is recovery currently blocked?",
      "hypothesis": "Static Xbox D3D/XDK code near the confirmed lifecycle/swap cluster retains more useful title semantics than PM4 and can be identified without execution.",
      "exact_source_symbol_or_guest_boundary": [
        "TU1 loaded post-patch image SHA-256 BF7300F7E0DEEE91444ACD50FBE69752F5CFD3CF51358186F1B849DF25A8CB00",
        "sub_82B6EA60",
        "sub_82B6F6C0",
        "sub_82B6FA48",
        "sub_82BA34D8",
        "sub_82AAC208 discovery lead"
      ],
      "minimum_fields_required": [
        "candidate guest start/end/size",
        "exact callers/callees and Xbox graphics imports",
        "r3-r10 and stack argument use",
        "persistent object offsets and state mutations",
        "thread/queue evidence",
        "operation coverage and forwarding side effects",
        "explicit recovery-blocked reason if no representative method qualifies"
      ],
      "data_explicitly_forbidden": [
        "shader bytecode or translated shader bodies",
        "texture, render-target, depth, EDRAM or buffer payloads",
        "screenshots unless the experiment explicitly requires a user checkpoint",
        "saves, XEX/XEXP bytes, game assets or proprietary filenames beyond already documented artifact identifiers",
        "unbounded register, memory or packet dumps",
        "new executable bytes or disassembly bodies in committed evidence"
      ],
      "default_off_fail_open_requirements": {
        "default_off": false,
        "fail_open": false,
        "requirements": [
          "Read-only analysis only; no runtime switch exists."
        ]
      },
      "control_run": "Not applicable. Reproduce results against the exact TU1 image and compare only with accepted G1 addresses.",
      "user_action": "None.",
      "criteria": {
        "pass": "At least one representative method has exact TU1 boundary, ABI, ownership/threading, side effects and operation meaning; or a precise, reproducible blocker is documented.",
        "fail": "A candidate is promoted from a name/string/call resemblance without exact ABI and control-flow evidence.",
        "inconclusive": "Semantics are plausible but ABI, coverage, ownership or threading remains ambiguous."
      },
      "rollback": "No repository/runtime state changes beyond documentation; discard only incorrect documentation edits.",
      "risk_and_privacy_classification": {
        "risk": "LOW",
        "privacy": "PRIVATE EXECUTABLE DERIVATIVE RISK",
        "notes": "Commit addresses, hashes, ranges and provenance only; never commit executable bytes."
      },
      "dependencies": [],
      "decision_unlocked": "Determines whether the preferred high semantic seam is viable and whether low-level correlation should be the next primary gate.",
      "estimated_evidence_level": "L1"
    },
    {
      "experiment_id": "EXP-G2A-LINK-001",
      "order": 2,
      "type": "BUILD/ABI",
      "question_answered": "Can a revised minimal sub_82BA34D8 wrapper link in the production Release binary and forward exactly once with disabled/enabled and recursion guards intact?",
      "hypothesis": "The preserved-original __imp__sub_82BA34D8 design is mechanically valid, but the general capture infrastructure is unnecessary for this proof.",
      "exact_source_symbol_or_guest_boundary": [
        "sub_82BA34D8",
        "__imp__sub_82BA34D8",
        "paused checkpoint 47c2ea2b7d9e14b09fd942c4b5f1bd11c46e2f51"
      ],
      "minimum_fields_required": [
        "linked symbol/RVA proof",
        "disabled wrapper count/original count",
        "enabled wrapper count/original count",
        "recursion-case wrapper/original counts",
        "exception/fail-open result",
        "Release binary identity"
      ],
      "data_explicitly_forbidden": [
        "shader bytecode or translated shader bodies",
        "texture, render-target, depth, EDRAM or buffer payloads",
        "screenshots unless the experiment explicitly requires a user checkpoint",
        "saves, XEX/XEXP bytes, game assets or proprietary filenames beyond already documented artifact identifiers",
        "unbounded register, memory or packet dumps",
        "guest r3/r4 memory dereferences",
        "general session/capture records"
      ],
      "default_off_fail_open_requirements": {
        "default_off": true,
        "fail_open": true,
        "requirements": [
          "Preserved original executes exactly once on every path.",
          "No production log or file output is required for exact-once proof."
        ]
      },
      "control_run": "Unmodified accepted Release binary or hook compiled default-off, followed by synthetic exact-once fixtures.",
      "user_action": "None for build/synthetic proof; runtime execution is a separately authorized later step.",
      "criteria": {
        "pass": "Release links the wrapper and original as distinct symbols; all synthetic/default-off/on/recursion cases execute the original exactly once.",
        "fail": "Link fails, symbol identity collapses, original count differs from one, or an exception can suppress forwarding.",
        "inconclusive": "Source/synthetic proof passes but no linked Release symbol proof exists."
      },
      "rollback": "Revert the revised G2A branch commit; do not touch the accepted G1.5 documentation branch runtime.",
      "risk_and_privacy_classification": {
        "risk": "MEDIUM",
        "privacy": "NO PAYLOAD CAPTURE",
        "notes": "Build/link change only; runtime use remains unauthorized."
      },
      "dependencies": [],
      "decision_unlocked": "Completes or rejects the swap-hook mechanism proof without claiming diagnostic value.",
      "estimated_evidence_level": "L1"
    },
    {
      "experiment_id": "EXP-CONFIG-CAP-001",
      "order": 3,
      "type": "RUNTIME METADATA",
      "question_answered": "What effective GPU configuration and D3D12 host capabilities apply to the exact active DLL and RTX 5080?",
      "hypothesis": "Several candidate paths are gated by configuration or capability, so source identity alone cannot establish applicability.",
      "exact_source_symbol_or_guest_boundary": [
        "anisotropic_override",
        "clear_memory_page_state",
        "async_shader_compilation",
        "D3D12 provider capability initialization",
        "PipelineCache::ConfigurePipeline"
      ],
      "minimum_fields_required": [
        "active DLL SHA-256 and size",
        "adapter name/vendor/device",
        "backend",
        "effective anisotropic_override",
        "effective clear_memory_page_state",
        "effective async_shader_compilation",
        "draw resolution scale and ROV/interlock selection",
        "vblank/vsync/present mode",
        "D3D12 alpha-factor capability",
        "listed D3D12 feature tiers already present in Run 047/048"
      ],
      "data_explicitly_forbidden": [
        "shader bytecode or translated shader bodies",
        "texture, render-target, depth, EDRAM or buffer payloads",
        "screenshots unless the experiment explicitly requires a user checkpoint",
        "saves, XEX/XEXP bytes, game assets or proprietary filenames beyond already documented artifact identifiers",
        "unbounded register, memory or packet dumps",
        "full process environment",
        "unrelated filesystem paths"
      ],
      "default_off_fail_open_requirements": {
        "default_off": true,
        "fail_open": true,
        "requirements": [
          "Emit once after configuration is finalized.",
          "If metadata output fails, continue with unchanged effective settings."
        ]
      },
      "control_run": "Same exact binary with snapshot disabled; compare only initialization outcome and artifact identity.",
      "user_action": "Launch and exit at the shortest authorized no-input checkpoint; no gameplay.",
      "criteria": {
        "pass": "One bounded record contains every required effective value and exact artifact/adapter identity.",
        "fail": "Enabling the snapshot changes any setting, startup outcome or GPU provider selection.",
        "inconclusive": "Any required value remains implicit/default-derived rather than recorded."
      },
      "rollback": "Disable the single metadata switch and delete only the verified ignored experiment directory.",
      "risk_and_privacy_classification": {
        "risk": "LOW",
        "privacy": "SYSTEM METADATA ONLY",
        "notes": "No payload, process environment or unrelated paths."
      },
      "dependencies": [],